{
  "$schema": "../schemas/scenario.json",
  "name": "categorical",
  "description": "Categorical features (5 features with 10 levels each) and 30% censoring",
  "n_samples": 1000,
  "n_features": 50,
  "n_predictive": 10,
  "covariate_type": "categorical",
  "n_categorical_features": 5,
  "cardinality": 10,
  "censoring_rate": 0.3,
  "weibull_scale": 0.5,
  "weibull_shape": 2.0,
  "coefficient_range": [-1.0, 1.0]
}
