{
  "$schema": "../schemas/scenario.json",
  "name": "mixed",
  "description": "Mixed continuous + categorical covariates with 30% censoring",
  "n_samples": 1000,
  "n_features": 10,
  "n_predictive": 5,
  "covariate_type": "mixed",
  "n_categorical_features": 3,
  "cardinality": 5,
  "censoring_rate": 0.3,
  "weibull_scale": 0.5,
  "weibull_shape": 2.0,
  "coefficient_range": [-1.0, 1.0]
}
